galaxy,gate_id,gate_status,evidence,endpoint_scores_allowed,endpoint_validation_claim,next_action,claim_boundary
NGC4013,N4013_NONOVERLAP_G1_SOURCE_NUMERIC,PASS,"line-of-sight warp, orientation, flare/scaleheight, radial lag, and extended component are source-side fields with uses_vobs_or_residual=false",False,False,"use these fields as the frozen source ledger for the mixed projection route",ngc4013_projection_mixed_nonoverlap_not_validation
NGC4013,N4013_NONOVERLAP_G2_WVO_MIXED_ROUTE,PASS_CAVEATED_REPLAY_ALLOWED,"warp/vertical/projection tokens can be assigned to one mixed WVO quotient contribution",True,False,"replay WVO as caveated source-frozen mixed projection route under existing controls",ngc4013_projection_mixed_nonoverlap_not_validation
NGC4013,N4013_NONOVERLAP_G3_XIT_CLOCK_ROUTE,BLOCKED,"no independent clock/readout proxy is present beyond warp, vertical, and lag tokens already assigned to WVO",False,False,"keep Xi_t=1 or diagnostic-only until independent clock evidence exists",ngc4013_projection_mixed_nonoverlap_not_validation
NGC4013,N4013_NONOVERLAP_G4_EXTENDED_COMPONENT,CROSSCHECK_ONLY,"extended component supports vertical-overlay plausibility but overlaps with H I flare/scaleheight as vertical structure evidence",False,False,"use as source cross-check rather than second amplitude channel",ngc4013_projection_mixed_nonoverlap_not_validation
NGC4013,N4013_NONOVERLAP_G5_EXPDISK_WVO_PROTOCOL,PROSPECTIVE_ONLY,"expdisk+WVO score is strongest in prior packet but cannot be retroactively promoted from old scoring",False,False,"use as prospective protocol shell for future holdout or uninspected analogue",ngc4013_projection_mixed_nonoverlap_not_validation
