galaxy,gate_id,gate_status,evidence,remaining_obligation,uses_vobs_or_residual,endpoint_scores_allowed,claim_boundary
NGC4088,N4088_DCR_G1_ADDITIVE_SOURCE_TOKENS_DECLARED,PASS,x_w_formula_freeze; q_warp; sigma_warp; C_warp,preserve additive-kernel provenance,False,False,ngc4088_time_projection_double_count_resolution_gate_not_endpoint
NGC4088,N4088_DCR_G2_CLOCK_SOURCE_TOKENS_DECLARED,PASS,f_PA; f_R; f_q; f_mem,preserve Xi_eff source-term provenance,False,False,ngc4088_time_projection_double_count_resolution_gate_not_endpoint
NGC4088,N4088_DCR_G3_OVERLAP_AUDIT,PASS_OVERLAP_COMPLETE,all current Xi_eff source terms overlap the additive warp/history route,set orthogonal clock residual to zero for combined route,False,False,ngc4088_time_projection_double_count_resolution_gate_not_endpoint
NGC4088,N4088_DCR_G4_CLOCK_ONLY_CONTROL_ALLOWED,PASS_CONTROL_ONLY,ADDITIVE_PLUS_CLOCK_IMPROVES_BUT_DOUBLE_COUNT_BLOCKED,"clock-only may be explored separately, not combined endpoint",False,False,ngc4088_time_projection_double_count_resolution_gate_not_endpoint
NGC4088,N4088_DCR_G5_COMBINED_ENDPOINT_POLICY,PASS_FREEZE_POLICY,accepted combined route uses Xi_eff=1 unless independent non-overlap clock evidence is supplied,build endpoint permission gate only for additive route or future non-overlap clock route,False,False,ngc4088_time_projection_double_count_resolution_gate_not_endpoint
