galaxy,current_role,current_response,priority_channel,secondary_channels,why_plausible,blocked_or_forbidden,next_gate,endpoint_allowed_now,evidence_status,claim_boundary
UGC12506,primary_stress_case_underpredicted,time/projection control improves but leaves large gap,mass_distribution_plus_metric_closure,observer_path_edgeon_projection; clock_readout_interval,"high inclination, high spin, extended low-density H I envelope, and source-native NFW/HSE context point to an envelope/closure readout that is stronger than the current small Xi_t cap",do not raise Xi_t amplitude from the rotation residual; path term remains zero until source/path evidence establishes it,derive source-frozen mass/envelope plus metric-closure readout and run ablation against Theta_morph and Xi_t cap-only controls,False,candidate_channel_strong_stress_not_endpoint,problematic_projection_channel_ledger_not_endpoint
NGC4088,improving_warp_history_asymmetry_case,time/projection control improves clearly,trajectory_phase_asymmetry_history,clock_readout_control_only,"source-side warp, asymmetry, and history context make an unsettled trajectory/phase readout natural; the clock replay improves but overlaps the accepted additive warp/history kernel",do not promote lower-RMSE additive-plus-clock stress curve until clock evidence is non-overlapping with the additive morphology route,keep accepted additive warp/history endpoint with Xi_eff=1; use clock replay as control unless independent clock evidence appears,False,accepted_additive_route_clock_control_only,problematic_projection_channel_ledger_not_endpoint
NGC4013,worsened_mixed_overlay_case,current Xi_t proxy worsens by double-counting,mixed_warp_vertical_overlay,none_for_current_Xi_t,edge-on warp and vertical overlay source context already enter the mixed kernel; the generic clock factor rescales the same geometry,no new Xi_t endpoint from current proxy; keep Xi_t=1 unless a fresh non-overlapping clock/readout observable is source-frozen,seek a fresh uninspected analogue or independent clock observable; otherwise preserve as retrospective mixed-reference control,False,current_clock_proxy_rejected_double_count,problematic_projection_channel_ledger_not_endpoint
NGC7331,worsened_broad_outer_warp_case,current Xi_t proxy worsens mildly by over-rescaling,source_sharpened_vertical_outer_warp,metric_closure_after_window_sharpening,the present broad vertical/outer-warp mixed window already carries the available phase information; a sharper source-native outer-warp onset is needed before adding any clock or closure layer,do not add Xi_t on the broad-window proxy; do not interpret the mild degradation as a Tau Core failure,"source-sharpen outer-warp/vertical window, then test metric/closure or refined mixed readout by replay before endpoint promotion",False,broad_window_saturated_refinement_required,problematic_projection_channel_ledger_not_endpoint
NGC5907,near_neutral_projection_saturated_case,time/projection proxy nearly neutral to slightly worse,observer_path_edgeon_projection,warp_truncation_projection,"edge-on line-of-sight stacking and warp/truncation make observer projection the natural channel, but the current projection kernel appears saturated",no clock/time promotion from present neutral replay,treat as projection-saturated control; only source-native path or vertical-profile data can justify a richer channel,False,projection_channel_saturated_control,problematic_projection_channel_ledger_not_endpoint
NGC4183,weak_null_projection_control,time/projection layer nearly null,quiet_weak_projection_limit,none,weak-projection tilted-ring source context supports a quiet/null limit rather than an extra active projection channel,"do not introduce active time, mass, or closure channels without new source evidence",retain as null/weak-projection control,False,null_control_keep_low_channel,problematic_projection_channel_ledger_not_endpoint
