galaxy,xi_trial_status,source_status,epsilon_0_source_frozen,xi_improves_full_time,best_trial_model,best_trial_rmse_km_s,readiness_reason,required_observables_for_accepted_xi_t,accepted_xi_t_manifest_allowed,endpoint_scores_allowed,claim_boundary
NGC4088,P1_PROMOTE_AFTER_SOURCE_REVIEW,warp_history_asymmetric_projection,0.0209999999999999,True,xi_t_on_full_time_morphology,8.349016673440337,"Xi_t improves and source status has strong warp/history/asymmetry context, but q/history and normalization caveats remain.",independent warp/asymmetry phase proxy; interaction/companion context; accepted normalization law,False,False,time_readout_xi_manifest_readiness_not_endpoint
UGC12506,P1_PROMOTE_AFTER_SOURCE_REVIEW,edgeon_highspin_projection_history_theta,0.0294559674173752,True,xi_t_on_full_time_morphology,62.96785163533952,Xi_t improves high-spin edge-on stress case; UGC12506 remains underpredicted but direction is source-consistent.,clock/readout proxy from high-spin settling; edge-on PV/envelope time-slice consistency; path/foreground review,False,False,time_readout_xi_manifest_readiness_not_endpoint
NGC4183,P2_NULL_CONTROL_KEEP_WEAK,weak_projection_null_control,0.0018,True,xi_t_on_full_time_morphology,6.238315821221436,Xi_t is nearly neutral and the object is a weak-projection/null-control case.,quiet-control confirmation; no strong Xi_t promotion unless new source evidence appears,False,False,time_readout_xi_manifest_readiness_not_endpoint
NGC4013,P3_REJECT_CURRENT_XI_T_PROXY,warp_vertical_overlay,0.0107999999999999,False,base_projection_morphology,11.450495413211732,Xi_t worsens an already strong warp/vertical-overlay curve; current proxy likely double-counts or over-rescales.,separate vertical overlay from clock-readout; do not promote Xi_t without independent clock evidence,False,False,time_readout_xi_manifest_readiness_not_endpoint
NGC5907,P3_REJECT_CURRENT_XI_T_PROXY,edgeon_projection_vertical_warp,0.0072,False,full_time_morphology_additive_proxy,15.49504368708925,Xi_t slightly worsens a saturated projection kernel; edge-on projection is already captured by the base kernel.,path-specific clock evidence beyond ordinary edge-on projection; otherwise keep Xi_t=1,False,False,time_readout_xi_manifest_readiness_not_endpoint
NGC7331,P3_REJECT_CURRENT_XI_T_PROXY,vertical_outer_warp_overlay,0.006,False,base_projection_morphology,22.255665651220575,Xi_t worsens the broad vertical/outer-warp mixed curve; current mixed kernel likely already carries available phase signal.,narrow outer-warp clock proxy and independent H I history coherence before any Xi_t promotion,False,False,time_readout_xi_manifest_readiness_not_endpoint
