subchannel,what_changes,formula_role,source_freeze_requirement,current_status,claim_boundary
observer_path_projection,which source clock slice is visible along the line of sight or light bundle,argument of Xi_t through O_obs/path,"inclination, edge-on overlay, warp visibility, beam/path geometry, foreground or path-environment audit",PROXY_PARTIAL_IN_PAPER2,time_readout_projection_channel_formula_conditional_not_endpoint
morphology_trajectory_phase,whether the current 4D morphology is a settled or phase-shifted readout slice,argument of Xi_t through Theta_morph,"settling state, warp/asymmetry stage, interaction history, relaxation or future-directed phase proxies",DIAGNOSTIC_PROXY_ONLY,time_readout_projection_channel_formula_conditional_not_endpoint
gravity_readout_projection,morphology/gravity residual is multiplied by the clock factor,Xi_t^2 [v_Newt^2 + delta_v_grav/morph^2],separate morphology/gravity residual shell frozen before time-readout scoring,FORMULA_SEPARATION_RECORDED,time_readout_projection_channel_formula_conditional_not_endpoint
clock_rate_time_slice_projection,effective time parameter used in the observed velocity quotient,Xi_t=1+epsilon_t; delta_v_t^2 ~= 2 epsilon_t (...),residual-blind clock/readout mismatch proxy,OPEN_NO_ACCEPTED_PROXY,time_readout_projection_channel_formula_conditional_not_endpoint
path_environment_projection,metric/matter environment of the observed light bundle can affect the clock/readout factor,possible E_proj/history dependence in Xi_t,source-observer null-geodesic bundle environment; reject image-plane coincidences without path evidence,OPEN_PATH_AWARE_KERNEL_NOT_MODELED,time_readout_projection_channel_formula_conditional_not_endpoint
