galaxy,evidence_id,evidence_class,source,statement,route_interpretation,status,uses_vobs_or_residual,claim_boundary
UGC12506,U12506_PB_E1_PRIOR_DIAGNOSTIC,diagnostic_score_reference,multigalaxy_fit_inspection_scores.csv,"Prior diagnostic TAU_BEST_FAMILY has RMSE 37.36 km/s and reports best_family=K_compact_finite, but validation_claim_allowed=False.","Useful signal about missing readout shape, not a source-accepted morphology label.",DIAGNOSTIC_ONLY_NOT_SOURCE_LABEL,True,ugc12506_prior_best_source_route_audit_not_endpoint
UGC12506,U12506_PB_E2_NFW_PREFERENCE,source_halo_fit_context,Hallenbeck2014 lines 730-738,UGC12506 has a very significant preference for the NFW halo model over the pseudo-isothermal model in the source discussion.,"Source pressure points toward rapid-rise / NFW-like halo-concentration readout, not toward a cored compact-support interpretation.",SOURCE_SUPPORTED_NFW_LIKE_ROUTE,False,ugc12506_prior_best_source_route_audit_not_endpoint
UGC12506,U12506_PB_E3_FAST_RISE,source_rotation_shape_context,"Hallenbeck2014 lines 679-681, 736-738","The rotation curve rises quickly to about 250 km/s, and the source notes this is unlike the slowly rising curves expected for many LSBs.",Supports a steep inner/halo-concentration shell rather than simply amplifying the outer envelope.,SOURCE_SUPPORTED_RAPID_RISE_ROUTE,False,ugc12506_prior_best_source_route_audit_not_endpoint
UGC12506,U12506_PB_E4_HIGH_SPIN,source_spin_context,"Hallenbeck2014 lines 800-811, 834-839",UGC12506 has high spin lambda=0.15 and a diffuse stable H I reservoir.,Supports coupling the rapid-rise shell to high-spin envelope support rather than using a generic compact family.,SOURCE_SUPPORTED_HIGH_SPIN_ROUTE,False,ugc12506_prior_best_source_route_audit_not_endpoint
UGC12506,U12506_PB_E5_COMPACT_CORED_ROUTE,negative_source_route,"Hallenbeck2014 lines 326-344, 730-738","The source defines a pseudo-isothermal cored halo option, but UGC12506 is reported to prefer NFW significantly.",Do not promote K_compact_finite as source-native for UGC12506 from the current evidence.,COMPACT_CORED_ROUTE_NOT_SOURCE_PROMOTED,False,ugc12506_prior_best_source_route_audit_not_endpoint
