galaxy,component_id,component_status,source_load,normalized_weight,kernel_column,source_basis,claim_boundary
UGC12506,T_HIGHSPIN_SETTLING,INCLUDED_SOURCE_SUPPORTED,1.0,0.4678843781790566,K_t_highspin_clock_spin,reported high-spin state lambda=0.15,ugc12506_xi_t_highspin_envelope_clock_shell_not_endpoint
UGC12506,T_EDGEON_PV_CLOCK_SLICE,INCLUDED_SOURCE_SUPPORTED,0.597080420622471,0.2793646013258344,K_t_highspin_clock_spin,high inclination and PV/envelope method required,ugc12506_xi_t_highspin_envelope_clock_shell_not_endpoint
UGC12506,T_ENVELOPE_SETTLING,INCLUDED_SOURCE_SUPPORTED_CAVEATED,0.4572719060523938,0.21395038142207626,K_t_highspin_clock_envelope,large diffuse low-density H I support,ugc12506_xi_t_highspin_envelope_clock_shell_not_endpoint
UGC12506,T_ASYMMETRIC_PV_PHASE,INCLUDED_SOURCE_SUPPORTED_CAVEATED,0.08292783619756539,0.038800639073032536,K_t_highspin_clock_asymmetry,approaching/receding side shape and length asymmetry,ugc12506_xi_t_highspin_envelope_clock_shell_not_endpoint
UGC12506,T_PATH_ENVIRONMENT,EXCLUDED_NOT_ESTABLISHED,0.0,0.0,K_t_path_environment,foreground/path object evidence is not established,ugc12506_xi_t_highspin_envelope_clock_shell_not_endpoint
