galaxy,evidence_id,source_id,evidence_type,text_line_range,paraphrased_evidence,supports_field,freezes_kernel_value,residual_blind,claim_boundary
UGC12506,UGC12506_HM_E1_HIGH_INCLINATION_PV_REQUIRED,UGC12506_HI_SRC1_HIGHMASS_VLA,projection_context,"206-225,681-690","The galaxy is highly inclined, so velocity-field curves underestimate rotation and the authors use a position-velocity/envelope method.",projection_enriched_kernel_candidate,False,True,ugc12506_highmass_fast_source_context_not_kernel_freeze
UGC12506,UGC12506_HM_E2_EXTENDED_HI_SUPPORT,UGC12506_HI_SRC1_HIGHMASS_VLA,hi_extent_context,666-673,"The H I disk is traced beyond 60 kpc and the observed H I radius is reported as 58 +/- 2 kpc, consistent with the expected radius.",outer_support_window,False,True,ugc12506_highmass_fast_source_context_not_kernel_freeze
UGC12506,UGC12506_HM_E3_ORDERED_BUT_ASYMMETRIC_PV,UGC12506_HI_SRC1_HIGHMASS_VLA,projection_asymmetry_context,680-696,"The galaxy shows ordered rotation to the detectable edge, but the approaching and receding sides differ in shape and length.",projection_or_lopsided_support_context,False,True,ugc12506_highmass_fast_source_context_not_kernel_freeze
UGC12506,UGC12506_HM_E4_LOW_DENSITY_STABLE_HI,UGC12506_HI_SRC1_HIGHMASS_VLA,closure_stability_context,719-735,"UGC12506 has low H I surface densities, typically 1-5 Msun/pc^2 out to 60 kpc, and is described as stable over most of the disk.",closure_load_context,False,True,ugc12506_highmass_fast_source_context_not_kernel_freeze
UGC12506,UGC12506_HM_E5_HIGH_SPIN_CONTEXT,UGC12506_HI_SRC1_HIGHMASS_VLA,history_memory_context,768-774,"The paper reports a very high spin parameter for UGC12506, interpreted as an unusual gas-rich high-spin state.",memory_history_or_high_spin_context,False,True,ugc12506_highmass_fast_source_context_not_kernel_freeze
