galaxy,gate_id,gate_status,evidence,remaining_obligation,endpoint_scores_allowed,claim_boundary
UGC12506,U12506_XIT_ACCEPT_G1_SOURCE_SHELL_EXISTS,PASS,UGC12506_XI_T_SOURCE_SHELL_BUILT_ACCEPTED_MANIFEST_BLOCKED,none,False,ugc12506_xi_t_accepted_manifest_gate_not_endpoint
UGC12506,U12506_XIT_ACCEPT_G2_NO_RESIDUAL_LEAKAGE,PASS,"shell, normalization, and cap summaries report uses_vobs_or_residual=False",none,False,ugc12506_xi_t_accepted_manifest_gate_not_endpoint
UGC12506,U12506_XIT_ACCEPT_G3_PATH_POLICY,PASS,path term remains zero because path evidence is NOT_ESTABLISHED,rerun cone/path review before any nonzero path term,False,ugc12506_xi_t_accepted_manifest_gate_not_endpoint
UGC12506,U12506_XIT_ACCEPT_G4_BOUNDED_SHAPE,PASS_CONDITIONAL,epsilon_t = epsilon_cap L/(1+L) with L>=0,class-level acceptance required before endpoint use,False,ugc12506_xi_t_accepted_manifest_gate_not_endpoint
UGC12506,U12506_XIT_ACCEPT_G5_CAP_PROTOCOL,PASS_PROTOCOL_FREEZE,epsilon_cap=0.035 lies inside epsilon_t<=0.04 small-mismatch bound,do not claim universal Tau constant,False,ugc12506_xi_t_accepted_manifest_gate_not_endpoint
UGC12506,U12506_XIT_ACCEPT_G6_SOURCE_PROXY_COMPLETENESS,PASS_CAVEATED_INTERVAL_REVIEW,accepted K_t(R) envelope mapping; epsilon_t normalization law; clock/readout settling proxy,"carry K_t(R) only as caveated interval/control manifest, not as standard endpoint permission; keep asymmetry as caveated phase component, not standalone route driver; keep path term fixed to zero unless a later path review supplies source evidence; record epsilon_cap as protocol cap, not universal Tau constant, in any accepted manifest; derive deeper Tau-side cap origin before any universal-law claim",False,ugc12506_xi_t_accepted_manifest_gate_not_endpoint
UGC12506,U12506_XIT_ACCEPT_G7_REVIEW_RESPONSE,PASS_CAVEATED_INTERVAL,ACCEPT_KT_CARRY_CAP_AS_CAVEATED_INTERVAL,standard endpoint still blocked,False,ugc12506_xi_t_accepted_manifest_gate_not_endpoint
UGC12506,U12506_XIT_ACCEPT_G8_ENDPOINT_PERMISSION,BLOCKED,endpoint_scores_allowed=False,run endpoint only after a separate endpoint permission gate,False,ugc12506_xi_t_accepted_manifest_gate_not_endpoint
